{
  "metrics": {
    "sentence_length": {
      "p25": {
        "target": 16.0,
        "tolerance_abs": 7
      },
      "p50": {
        "target": 22.0,
        "tolerance_abs": 7
      },
      "p75": {
        "target": 31.0,
        "tolerance_abs": 12
      }
    },
    "paragraph": {
      "p50_len": {
        "target": 99.0,
        "tolerance_abs": 50
      },
      "dialogue_para_ratio": {
        "target": 0.026,
        "tolerance_abs": 0.05
      }
    },
    "quote_char_ratio": {
      "target": 0.031,
      "tolerance_abs": 0.05
    },
    "punctuation_per_1k": {
      "；": {
        "target": 10.3,
        "tolerance_rel": 0.5
      },
      "？": {
        "target": 3.2,
        "tolerance_rel": 0.5
      },
      "—": {
        "target": 2.0,
        "tolerance_rel": 0.6
      }
    },
    "reduplication_per_1k": {
      "target": 20.6,
      "tolerance_rel": 0.45
    }
  },
  "reference": {
    "chars_total": 4076,
    "sentence_length": {
      "count": 168,
      "mean": 24.26,
      "p25": 16.0,
      "p50": 22.0,
      "p75": 31.0
    },
    "paragraph": {
      "count": 39,
      "p50_len": 99.0,
      "dialogue_para_ratio": 0.026
    },
    "quote_char_ratio": 0.031,
    "punctuation_per_1k": {
      "—": 1.963,
      "“": 2.453,
      "”": 2.453,
      "、": 0.981,
      "。": 33.857,
      "《": 0.491,
      "》": 0.491,
      "！": 1.963,
      "，": 72.375,
      "：": 1.227,
      "；": 10.304,
      "？": 3.189
    },
    "reduplication_per_1k": 20.608,
    "top_chars": [
      {
        "char": "的",
        "per_1k": 44.161
      },
      {
        "char": "我",
        "per_1k": 20.608
      },
      {
        "char": "了",
        "per_1k": 19.627
      },
      {
        "char": "是",
        "per_1k": 14.72
      },
      {
        "char": "一",
        "per_1k": 14.475
      },
      {
        "char": "着",
        "per_1k": 14.23
      },
      {
        "char": "他",
        "per_1k": 12.512
      },
      {
        "char": "不",
        "per_1k": 12.267
      },
      {
        "char": "子",
        "per_1k": 11.531
      },
      {
        "char": "去",
        "per_1k": 10.55
      },
      {
        "char": "里",
        "per_1k": 10.059
      },
      {
        "char": "上",
        "per_1k": 9.323
      },
      {
        "char": "有",
        "per_1k": 8.587
      },
      {
        "char": "在",
        "per_1k": 8.587
      },
      {
        "char": "来",
        "per_1k": 7.115
      },
      {
        "char": "地",
        "per_1k": 6.624
      },
      {
        "char": "这",
        "per_1k": 6.624
      },
      {
        "char": "时",
        "per_1k": 6.133
      },
      {
        "char": "过",
        "per_1k": 6.133
      },
      {
        "char": "像",
        "per_1k": 5.888
      },
      {
        "char": "也",
        "per_1k": 5.643
      },
      {
        "char": "日",
        "per_1k": 5.397
      },
      {
        "char": "人",
        "per_1k": 4.907
      },
      {
        "char": "又",
        "per_1k": 4.661
      },
      {
        "char": "走",
        "per_1k": 4.661
      },
      {
        "char": "们",
        "per_1k": 4.416
      },
      {
        "char": "月",
        "per_1k": 4.416
      },
      {
        "char": "到",
        "per_1k": 4.171
      },
      {
        "char": "见",
        "per_1k": 4.171
      },
      {
        "char": "花",
        "per_1k": 3.925
      }
    ],
    "fourgram_top": [
      "我们的日",
      "子为什么",
      "一去不复",
      "家中光景",
      "一半为了",
      "但他终于",
      "忽然想起",
      "什么都可",
      "叶子和花"
    ]
  },
  "notes": "targets 由全量语料统计值取整并加容差（句长 ±30%、比例 ±0.05~0.15、标点与叠词 ±35~50%）；reference 保存完整实测快照。待验样本 <1000 字时，标点与比例类指标波动大，以句长分布与对话段落比为主要判据。",
  "delta_profile": {
    "chars": {
      "的": [
        47.0582,
        13.7128
      ],
      "我": [
        20.0332,
        11.3327
      ],
      "了": [
        19.0453,
        5.9484
      ],
      "是": [
        15.5282,
        4.8966
      ],
      "一": [
        15.359,
        4.0995
      ],
      "着": [
        15.6024,
        5.5933
      ],
      "不": [
        12.1356,
        5.1349
      ],
      "在": [
        10.2583,
        3.5336
      ],
      "们": [
        7.4212,
        5.7626
      ],
      "有": [
        9.6332,
        3.9443
      ],
      "子": [
        9.9106,
        5.0353
      ],
      "他": [
        8.7769,
        10.0139
      ],
      "这": [
        7.3266,
        3.2615
      ],
      "里": [
        8.5697,
        4.8506
      ],
      "上": [
        8.3514,
        3.8965
      ],
      "人": [
        6.2901,
        4.2828
      ],
      "来": [
        7.096,
        3.3413
      ],
      "那": [
        5.9133,
        3.6733
      ],
      "也": [
        5.6477,
        2.2576
      ],
      "时": [
        6.06,
        3.6022
      ],
      "大": [
        5.0519,
        2.2645
      ],
      "去": [
        7.0233,
        6.8807
      ],
      "个": [
        4.605,
        2.5752
      ],
      "说": [
        3.6473,
        3.9009
      ],
      "小": [
        4.7973,
        3.0447
      ],
      "地": [
        5.4695,
        3.0683
      ],
      "得": [
        3.4125,
        2.5687
      ],
      "然": [
        3.2745,
        1.4986
      ],
      "到": [
        3.916,
        1.9177
      ],
      "只": [
        3.6913,
        2.8651
      ],
      "过": [
        4.352,
        3.081
      ],
      "看": [
        3.5157,
        3.5829
      ],
      "便": [
        3.3811,
        2.1835
      ],
      "可": [
        3.0199,
        1.8707
      ],
      "儿": [
        3.7821,
        2.6034
      ],
      "下": [
        3.4717,
        1.4424
      ],
      "但": [
        3.2222,
        1.4992
      ],
      "像": [
        4.5618,
        4.7212
      ],
      "又": [
        3.7179,
        2.9201
      ],
      "好": [
        2.7861,
        2.0533
      ],
      "些": [
        3.1319,
        1.4371
      ],
      "船": [
        1.4316,
        2.9513
      ],
      "自": [
        2.5168,
        2.1417
      ],
      "要": [
        2.6142,
        2.2665
      ],
      "天": [
        3.9242,
        3.4997
      ],
      "她": [
        2.3451,
        2.8312
      ],
      "出": [
        2.9056,
        1.0167
      ],
      "和": [
        2.6245,
        1.3481
      ],
      "两": [
        2.6453,
        1.2749
      ],
      "光": [
        2.2572,
        2.0938
      ],
      "以": [
        2.2468,
        1.7714
      ],
      "多": [
        2.8108,
        1.1602
      ],
      "样": [
        2.4125,
        1.1929
      ],
      "起": [
        3.0325,
        2.0368
      ],
      "见": [
        2.9528,
        2.2194
      ],
      "都": [
        2.6528,
        1.8626
      ],
      "为": [
        2.252,
        1.3038
      ],
      "从": [
        2.9454,
        2.9053
      ],
      "中": [
        2.4232,
        1.2193
      ],
      "面": [
        2.1796,
        1.344
      ],
      "想": [
        2.1029,
        1.2527
      ],
      "所": [
        1.563,
        1.6254
      ],
      "之": [
        1.9269,
        1.5193
      ],
      "却": [
        1.8897,
        1.0707
      ],
      "而": [
        2.4077,
        1.6387
      ],
      "于": [
        1.9683,
        1.62
      ],
      "能": [
        2.0876,
        1.3153
      ],
      "孩": [
        1.7393,
        2.9905
      ],
      "亲": [
        2.3295,
        2.6485
      ],
      "么": [
        2.5736,
        2.5769
      ],
      "月": [
        2.4252,
        2.8918
      ],
      "你": [
        2.8355,
        2.903
      ],
      "还": [
        2.2043,
        1.8065
      ],
      "如": [
        2.1079,
        1.7045
      ],
      "年": [
        2.2625,
        1.5998
      ],
      "走": [
        2.7344,
        2.3403
      ],
      "无": [
        1.4127,
        1.2694
      ],
      "水": [
        2.2033,
        1.4861
      ],
      "回": [
        1.9498,
        1.6444
      ],
      "已": [
        2.2188,
        1.4086
      ],
      "灯": [
        1.2764,
        2.0265
      ],
      "心": [
        1.5893,
        1.1833
      ],
      "觉": [
        1.4176,
        0.9395
      ],
      "前": [
        1.5045,
        1.1818
      ],
      "白": [
        2.3152,
        1.5518
      ],
      "头": [
        1.8618,
        0.8586
      ],
      "眼": [
        2.5077,
        1.7615
      ],
      "种": [
        1.6978,
        3.2984
      ],
      "歌": [
        0.9787,
        1.8706
      ],
      "河": [
        0.8103,
        1.759
      ],
      "真": [
        1.4146,
        1.2341
      ],
      "家": [
        2.0197,
        1.8973
      ],
      "日": [
        3.2337,
        5.9924
      ],
      "与": [
        1.5086,
        0.9138
      ],
      "现": [
        1.457,
        1.0145
      ],
      "呢": [
        2.3606,
        4.2713
      ],
      "花": [
        2.5344,
        3.2415
      ],
      "父": [
        1.7764,
        2.5024
      ],
      "将": [
        1.6193,
        0.8944
      ],
      "事": [
        1.6688,
        1.6924
      ],
      "似": [
        1.6042,
        1.2326
      ],
      "处": [
        1.3992,
        1.4512
      ],
      "风": [
        2.2757,
        2.237
      ],
      "边": [
        2.0827,
        1.6688
      ],
      "声": [
        1.3704,
        1.2716
      ],
      "知": [
        1.1307,
        0.917
      ],
      "道": [
        1.4674,
        1.478
      ],
      "三": [
        1.5465,
        0.8253
      ],
      "就": [
        1.2355,
        0.6742
      ],
      "候": [
        2.0384,
        2.6359
      ],
      "秦": [
        0.7115,
        1.3375
      ],
      "路": [
        1.7861,
        1.9792
      ],
      "西": [
        1.4762,
        1.8125
      ],
      "意": [
        0.9265,
        0.9566
      ],
      "几": [
        1.6562,
        1.1778
      ],
      "很": [
        1.2212,
        0.9606
      ],
      "色": [
        1.1267,
        1.2728
      ],
      "没": [
        1.54,
        0.8566
      ],
      "点": [
        1.6047,